{
  "version": 1,
  "cases": [
    {
      "id": "CASE-01",
      "version": 1,
      "title": "Feedback vor Kunden",
      "field": 3,
      "objective": "Rückmeldung auf beobachtbares Verhalten beziehen und selbstständige Anwendung ermöglichen.",
      "context": "Autohaus: Mia nennt vor einem Kunden erneut einen falschen Liefertermin. Sie sagt, niemand habe es richtig erklärt.",
      "nodes": [
        {
          "id": "start",
          "prompt": "Wie gehst du zunächst vor?",
          "choices": [
            {
              "id": "a",
              "text": "Sachlich korrigieren und anschließend ungestört die Informationsquelle gemeinsam prüfen.",
              "consequence": "Mia zeigt dir zwei widersprüchliche Listen.",
              "reasoning": "Rückmeldung auf beobachtbares Verhalten beziehen und selbstständige Anwendung ermöglichen.",
              "next": "transfer"
            },
            {
              "id": "b",
              "text": "Den Kunden informieren, aber Mia vor ihm als unaufmerksam bezeichnen.",
              "consequence": "Mia antwortet nur noch knapp und vermeidet weitere Nachfragen.",
              "reasoning": "Diese Entscheidung lässt den konkreten Lernbedarf oder die Ausbildungsplanung unzureichend geklärt.",
              "next": "repair"
            }
          ]
        },
        {
          "id": "transfer",
          "prompt": "Mia zeigt dir zwei widersprüchliche Listen. Was ist jetzt der passende nächste Schritt?",
          "choices": [
            {
              "id": "a",
              "text": "Die aktuelle Quelle kennzeichnen und Mia den nächsten Termin selbst prüfen lassen.",
              "consequence": "Du erfährst, ob Mia den Prüfweg selbstständig nutzen kann.",
              "reasoning": "Rückmeldung auf beobachtbares Verhalten beziehen und selbstständige Anwendung ermöglichen.",
              "next": null
            },
            {
              "id": "b",
              "text": "Ab jetzt alle Termine selbst nennen.",
              "consequence": "Mia erhält keine Gelegenheit, den richtigen Prüfweg einzuüben.",
              "reasoning": "Prüfe, ob die Person tatsächlich selbstständig handeln kann und ob die Bedingungen zur Aufgabe passen.",
              "next": null
            }
          ]
        },
        {
          "id": "repair",
          "prompt": "Mia antwortet nur noch knapp und vermeidet weitere Nachfragen. Wie entwickelst du die Situation weiter?",
          "choices": [
            {
              "id": "a",
              "text": "Die öffentliche Abwertung ansprechen und ein vertrauliches Klärungsgespräch anbieten.",
              "consequence": "Du eröffnest wieder Raum für die Klärung von Lernhindernissen.",
              "reasoning": "Rückmeldung auf beobachtbares Verhalten beziehen und selbstständige Anwendung ermöglichen.",
              "next": null
            },
            {
              "id": "b",
              "text": "Ihre Zurückhaltung als Beweis mangelnder Motivation werten.",
              "consequence": "Die Ursache bleibt ungeklärt.",
              "reasoning": "Ein ungeklärter Lernbedarf wird durch ein pauschales Urteil oder bloßes Fortsetzen nicht gelöst.",
              "next": null
            }
          ]
        }
      ],
      "sources": [
        {
          "title": "AEVO § 3: Handlungsfelder und Kompetenzen",
          "url": "https://www.gesetze-im-internet.de/ausbeignv_2009/__3.html"
        }
      ],
      "approved": true,
      "reviewDate": null,
      "approvalBasis": "owner_confirmation",
      "approvalConfirmedOn": "2026-09-20",
      "approvalConfirmedBy": "Julian Kürten"
    },
    {
      "id": "CASE-02",
      "version": 1,
      "title": "Messung unter Zeitdruck",
      "field": 3,
      "objective": "Fehlerursache erkennen und eine passende Lernkontrolle gestalten.",
      "context": "Werkstatt: Leon soll ein Werkstück messen. Er liest den Messschieber mehrfach falsch ab. Ein Kollege drängt zum schnellen Abschluss.",
      "nodes": [
        {
          "id": "start",
          "prompt": "Wie gehst du zunächst vor?",
          "choices": [
            {
              "id": "a",
              "text": "Die Arbeit kurz sichern und Leon den Ablesevorgang erklären lassen.",
              "consequence": "Leon verwechselt die Skalen.",
              "reasoning": "Fehlerursache erkennen und eine passende Lernkontrolle gestalten.",
              "next": "transfer"
            },
            {
              "id": "b",
              "text": "Das Ergebnis vorsagen, damit der Auftrag schneller fertig wird.",
              "consequence": "Das Werkstück ist fertig, aber Leons Verständnis bleibt unklar.",
              "reasoning": "Diese Entscheidung lässt den konkreten Lernbedarf oder die Ausbildungsplanung unzureichend geklärt.",
              "next": "repair"
            }
          ]
        },
        {
          "id": "transfer",
          "prompt": "Leon verwechselt die Skalen. Was ist jetzt der passende nächste Schritt?",
          "choices": [
            {
              "id": "a",
              "text": "Eine gezielte Demonstration mit anschließendem selbstständigem Messen verbinden.",
              "consequence": "Eine neue Messung macht den Lernfortschritt sichtbar.",
              "reasoning": "Fehlerursache erkennen und eine passende Lernkontrolle gestalten.",
              "next": null
            },
            {
              "id": "b",
              "text": "Den gesamten Auftrag erneut vorführen, ohne Leon messen zu lassen.",
              "consequence": "Zuschauen allein zeigt noch keine eigene Handlungskompetenz.",
              "reasoning": "Prüfe, ob die Person tatsächlich selbstständig handeln kann und ob die Bedingungen zur Aufgabe passen.",
              "next": null
            }
          ]
        },
        {
          "id": "repair",
          "prompt": "Das Werkstück ist fertig, aber Leons Verständnis bleibt unklar. Wie entwickelst du die Situation weiter?",
          "choices": [
            {
              "id": "a",
              "text": "Für die nächste sichere Übung Zeit einplanen und den Lernstand ermitteln.",
              "consequence": "Die offene Lernaufgabe wird bearbeitbar.",
              "reasoning": "Fehlerursache erkennen und eine passende Lernkontrolle gestalten.",
              "next": null
            },
            {
              "id": "b",
              "text": "Den fertigen Auftrag als Lernerfolg verbuchen.",
              "consequence": "Arbeitsabschluss und Lernzielerreichung werden verwechselt.",
              "reasoning": "Ein ungeklärter Lernbedarf wird durch ein pauschales Urteil oder bloßes Fortsetzen nicht gelöst.",
              "next": null
            }
          ]
        }
      ],
      "sources": [
        {
          "title": "AEVO § 3: Handlungsfelder und Kompetenzen",
          "url": "https://www.gesetze-im-internet.de/ausbeignv_2009/__3.html"
        }
      ],
      "approved": true,
      "reviewDate": null,
      "approvalBasis": "owner_confirmation",
      "approvalConfirmedOn": "2026-09-20",
      "approvalConfirmedBy": "Julian Kürten"
    },
    {
      "id": "CASE-03",
      "version": 1,
      "title": "Stille im Lernteam",
      "field": 3,
      "objective": "Beteiligung ermöglichen und soziale Lernbedingungen gestalten.",
      "context": "Büro: Im Projekt sprechen zwei Auszubildende fast durchgehend. Eine dritte Person bleibt still, obwohl ihre schriftlichen Ideen gut sind.",
      "nodes": [
        {
          "id": "start",
          "prompt": "Wie gehst du zunächst vor?",
          "choices": [
            {
              "id": "a",
              "text": "Nach einer kurzen Einzelphase alle ihre Vorschläge vorstellen lassen.",
              "consequence": "Es liegen drei unterschiedliche Lösungsideen vor.",
              "reasoning": "Beteiligung ermöglichen und soziale Lernbedingungen gestalten.",
              "next": "transfer"
            },
            {
              "id": "b",
              "text": "Die beiden Vielredenden weiterarbeiten lassen, weil es schneller geht.",
              "consequence": "Die stille Person zieht sich auch aus der Dokumentation zurück.",
              "reasoning": "Diese Entscheidung lässt den konkreten Lernbedarf oder die Ausbildungsplanung unzureichend geklärt.",
              "next": "repair"
            }
          ]
        },
        {
          "id": "transfer",
          "prompt": "Es liegen drei unterschiedliche Lösungsideen vor. Was ist jetzt der passende nächste Schritt?",
          "choices": [
            {
              "id": "a",
              "text": "Ideen anhand gemeinsam vereinbarter Kriterien vergleichen.",
              "consequence": "Beiträge werden nach Inhalt beurteilt.",
              "reasoning": "Beteiligung ermöglichen und soziale Lernbedingungen gestalten.",
              "next": null
            },
            {
              "id": "b",
              "text": "Die lauteste Position ohne Prüfung übernehmen.",
              "consequence": "Lautstärke ersetzt die sachliche Entscheidung.",
              "reasoning": "Prüfe, ob die Person tatsächlich selbstständig handeln kann und ob die Bedingungen zur Aufgabe passen.",
              "next": null
            }
          ]
        },
        {
          "id": "repair",
          "prompt": "Die stille Person zieht sich auch aus der Dokumentation zurück. Wie entwickelst du die Situation weiter?",
          "choices": [
            {
              "id": "a",
              "text": "Die Aufgabenverteilung im Team besprechen und Beteiligungswege vereinbaren.",
              "consequence": "Beteiligung wird konkret möglich.",
              "reasoning": "Beteiligung ermöglichen und soziale Lernbedingungen gestalten.",
              "next": null
            },
            {
              "id": "b",
              "text": "Der stillen Person pauschal Teamunfähigkeit vorwerfen.",